"“She was now, on being settled at home, at leisure to observe the real state of her sister's spirits. Jane was not happy. She still cherished a very tender affection for Bingley. Having never even fancied herself in love before, her regard had all the warmth of first attachment, and, from her age and disposition, greater steadiness than most first attachments often boast; and so fervently did she value his remembrance, and prefer him to every other man, that all her good sense, and all her attention to the feelings of her friends, were requisite to check the indulgence of those regrets which must have been injurious to her own health and their tranquillity.”",,,,,,
"“The long grass rustled at her feet as the White Rabbit hurried by—the frightened Mouse splashed his way through the neighbouring pool—she could hear the rattle of the teacups as the March Hare and his friends shared their never-ending meal, and the shrill voice of the Queen ordering off her unfortunate guests to execution—once more the pig-baby was sneezing on the Duchess's knee, while plates and dishes crashed around it—once more the shriek of the Gryphon, the squeaking of the Lizard's slate-pencil, and the choking of the suppressed guinea-pigs, filled the air, mixed up with the distant sobs of the miserable Mock Turtle.”",,,,,,
"“It was in the latter days of September, and the equinoctial gales had set in with exceptional violence. All day the wind had screamed and the rain had beaten against the windows, so that even here in the heart of great, hand-made London we were forced to raise our minds for the instant from the routine of life and to recognise the presence of those great elemental forces which shriek at mankind through the bars of his civilisation, like untamed beasts in a cage. As evening drew in, the storm grew higher and louder, and the wind cried and sobbed like a child in the chimney. Sherlock Holmes sat moodily at one side of the fireplace cross-indexing his records of crime, while I at the other was deep in one of Clark Russell’s fine sea-stories until the howl of the gale from without seemed to blend with the text, and the splash of the rain to lengthen out into the long swash of the sea waves. My wife was on a visit to her mother’s, and for a few days I was a dweller once more in my old quarters at Baker Street”",,,,,,
"Tom's voice trembled whilst he was reading them, and he most broke down. When he got done he couldn't no way make up his mind which one for Jim to scrabble on to the wall, they was all so good; but at last he allowed he would let him scrabble them all on.  Jim said it would take him a year to scrabble such a lot of truck on to the logs with a nail, and he didn't know how to make letters, besides; but Tom said he would block them out for him, and then he wouldn't have nothing to do but just follow the lines.",,,,,,
"Sea Catch sunk his head proudly between his fat shoulders and pretended to go to sleep for a few minutes, but all the time he was keeping a sharp lookout for a fight. Now that all the seals and their wives were on the land, you could hear their clamor miles out to sea above the loudest gales. At the lowest counting there were over a million seals on the beach—old seals, mother seals, tiny babies, and holluschickie, fighting, scuffling, bleating, crawling, and playing together—going down to the sea and coming up from it in gangs and regiments, lying over every foot of ground as far as the eye could reach, and skirmishing about in brigades through the fog. It is nearly always foggy at Novastoshnah, except when the sun comes out and makes everything look all pearly and rainbow-colored for a little while.",,,,,,
"But Gregor had had no intention of frightening anyone, least of all his sister. All he had done was begin to turn round so that he could go back into his room, although that was in itself quite startling as his pain-wracked condition meant that turning round required a great deal of effort and he was using his head to help himself do it, repeatedly raising it and striking it against the floor. He stopped and looked round. They seemed to have realised his good intention and had only been alarmed briefly. Now they all looked at him in unhappy silence. His mother lay in her chair with her legs stretched out and pressed against each other, her eyes nearly closed with exhaustion; his sister sat next to his father with her arms around his neck.",,,,,,
"The line is immaterial.  Mr. Worthing, I confess I feel somewhat bewildered by what you have just told me.  To be born, or at any rate bred, in a hand-bag, whether it had handles or not, seems to me to display a contempt for the ordinary decencies of family life that reminds one of the worst excesses of the French Revolution.  And I presume you know what that unfortunate movement led to?  As for the particular locality in which the hand-bag was found, a cloak-room at a railway station might serve to conceal a social indiscretion—has probably, indeed, been used for that purpose before now—but it could hardly be regarded as an assured basis for a recognised position in good society.",,,,,,
"This wine-shop keeper was a bull-necked, martial-looking man of thirty, and he should have been of a hot temperament, for, although it was a bitter day, he wore no coat, but carried one slung over his shoulder. His shirt-sleeves were rolled up, too, and his brown arms were bare to the elbows. Neither did he wear anything more on his head than his own crisply-curling short dark hair. He was a dark man altogether, with good eyes and a good bold breadth between them. Good-humoured looking on the whole, but implacable-looking, too; evidently a man of a strong resolution and a set purpose; a man not desirable to be met, rushing down a narrow pass with a gulf on either side, for nothing would turn the man.",,,,,,
"In these unequal unions, when the male exceeds the female in point of size, his union with a woman who is immediately next to him in size is called high union, and is of two kinds; while his union with the woman most remote from him in size is called the highest union, and is of one kind only. On the other hand when the female exceeds the male in point of size, her union with a man immediately next to her in size is called low union, and is of two kinds; while her union with a man most remote from her in size is called the lowest union, and is of one kind only.",,,,,,
"Having parted from my friend, I determined to visit some remote spot of Scotland and finish my work in solitude. I did not doubt but that the monster followed me and would discover himself to me when I should have finished, that he might receive his companion. With this resolution I traversed the northern highlands and fixed on one of the remotest of the Orkneys as the scene of my labours. It was a place fitted for such a work, being hardly more than a rock whose high sides were continually beaten upon by the waves. The soil was barren, scarcely affording pasture for a few miserable cows, and oatmeal for its inhabitants, which consisted of five persons, whose gaunt and scraggy limbs gave tokens of their miserable fare. Vegetables and bread, when they indulged in such luxuries, and even fresh water, was to be procured from the mainland, which was about five miles distant.",,,,,,
"I came up here alone, for I am very sad. There was no letter for me. I hope there cannot be anything the matter with Jonathan. The clock has just struck nine. I see the lights scattered all over the town, sometimes in rows where the streets are, and sometimes singly; they run right up the Esk and die away in the curve of the valley. To my left the view is cut off by a black line of roof of the old house next the abbey. The sheep and lambs are bleating in the fields away behind me, and there is a clatter of a donkey’s hoofs up the paved road below. The band on the pier is playing a harsh waltz in good time, and further along the quay there is a Salvation Army meeting in a back street. Neither of the bands hears the other, but up here I hear and see them both. I wonder where Jonathan is and if he is thinking of me! I wish he were here.",,,,,,
"Aunt Polly's happiness was complete, and Mrs. Thatcher's nearly so. It would be complete, however, as soon as the messenger dispatched with the great news to the cave should get the word to her husband. Tom lay upon a sofa with an eager auditory about him and told the history of the wonderful adventure, putting in many striking additions to adorn it withal; and closed with a description of how he left Becky and went on an exploring expedition; how he followed two avenues as far as his kite-line would reach; how he followed a third to the fullest stretch of the kite-line, and was about to turn back when he glimpsed a far-off speck that looked like daylight; dropped the line and groped toward it, pushed his head and shoulders through a small hole, and saw the broad Mississippi rolling by!",,,,,,
"He faced about and, standing between the awnings, held out his right hand at arm's length towards the sun. Wanted to try that often. Yes: completely. The tip of his little finger blotted out the sun's disk. Must be the focus where the rays cross. If I had black glasses. Interesting. There was a lot of talk about those sunspots when we were in Lombard street west. Looking up from the back garden. Terrific explosions they are. There will be a total eclipse this year: autumn some time.",,,,,,
"But one morning, turning to pass the doubloon, he seemed to be newly attracted by the strange figures and inscriptions stamped on it, as though now for the first time beginning to interpret for himself in some monomaniac way whatever significance might lurk in them. And some certain significance lurks in all things, else all things are little worth, and the round world itself but an empty cipher, except to sell by the cartload, as they do hills about Boston, to fill up some morass in the Milky Way.",,,,,,
"Just then another visitor entered the drawing room: Prince Andrew Bolkónski, the little princess' husband. He was a very handsome young man, of medium height, with firm, clearcut features. Everything about him, from his weary, bored expression to his quiet, measured step, offered a most striking contrast to his quiet, little wife. It was evident that he not only knew everyone in the drawing room, but had found them to be so tiresome that it wearied him to look at or listen to them. And among all these faces that he found so tedious, none seemed to bore him so much as that of his pretty wife. He turned away from her with a grimace that distorted his handsome face, kissed Anna Pávlovna's hand, and screwing up his eyes scanned the whole company.",,,,,,
"When the half-hour struck, he passed his hand across his forehead, and then got up hastily and dressed himself with even more than his usual care, giving a good deal of attention to the choice of his necktie and scarf-pin and changing his rings more than once. He spent a long time also over breakfast, tasting the various dishes, talking to his valet about some new liveries that he was thinking of getting made for the servants at Selby, and going through his correspondence. At some of the letters, he smiled. Three of them bored him. One he read several times over and then tore up with a slight look of annoyance in his face.",,,,,,
"It was now three mornings since they had left their father's house. They began to walk again, but they always came deeper into the forest, and if help did not come soon, they must die of hunger and weariness. When it was mid-day, they saw a beautiful snow-white bird sitting on a bough, which sang so delightfully that they stood still and listened to it. And when its song was over, it spread its wings and flew away before them, and they followed it until they reached a little house, on the roof of which it alighted; and when they approached the little house they saw that it was built of bread and covered with cakes, but that the windows were of clear sugar. ",,,,,,
"One fine evening a young princess put on her bonnet and clogs, and went out to take a walk by herself in a wood; and when she came to a cool spring of water, that rose in the midst of it, she sat herself down to rest a while. Now she had a golden ball in her hand, which was her favourite plaything; and she was always tossing it up into the air, and catching it again as it fell. After a time she threw it up so high that she missed catching it as it fell; and the ball bounded away, and rolled along upon the ground, till at last it fell down into the spring. The princess looked into the spring after her ball, but it was very deep, so deep that she could not see the bottom of it.",,,,,,
"Early in the morning, before it was quite light, and when nobody was stirring in the inn, Chanticleer awakened his wife, and, fetching the egg, they pecked a hole in it, ate it up, and threw the shells into the fireplace: they then went to the pin and needle, who were fast asleep, and seizing them by the heads, stuck one into the landlord's easy chair and the other into his handkerchief; and, having done this, they crept away as softly as possible. However, the duck, who slept in the open air in the yard, heard them coming, and jumping into the brook which ran close by the inn, soon swam out of their reach.",,,,,,
"The king's son was beside himself with pain, and in his despair he leapt down from the tower. He escaped with his life, but the thorns into which he fell pierced his eyes. Then he wandered quite blind about the forest, ate nothing but roots and berries, and did naught but lament and weep over the loss of his dearest wife. Thus he roamed about in misery for some years, and at length came to the desert where Rapunzel, with the twins to which she had given birth, a boy and a girl, lived in wretchedness. He heard a voice, and it seemed so familiar to him that he went towards it, and when he approached, Rapunzel knew him and fell on his neck and wept. Two of her tears wetted his eyes and they grew clear again, and he could see with them as before. He led her to his kingdom where he was joyfully received, and they lived for a long time afterwards, happy and contented.",,,,,,
"Influenced by those remarks, the bird next morning refused to bring in the wood, telling the others that he had been their servant long enough, and had been a fool into the bargain, and that it was now time to make a change, and to try some other way of arranging the work. Beg and pray as the mouse and the sausage might, it was of no use; the bird remained master of the situation, and the venture had to be made. They therefore drew lots, and it fell to the sausage to bring in the wood, to the mouse to cook, and to the bird to fetch the water.",,,,,,
"Then she went in to her mother and sister, and as she was so richly covered with gold, they gave her a warm welcome. She related to them all that had happened, and when the mother heard how she had come by her great riches, she thought she should like her ugly, lazy daughter to go and try her fortune. So she made the sister go and sit by the well and spin, and the girl pricked her finger and thrust her hand into a thorn-bush, so that she might drop some blood on to the spindle; then she threw it into the well, and jumped in herself.",,,,,,
"There was once a very old man, whose eyes had become dim, his ears dull of hearing, his knees trembled, and when he sat at table he could hardly hold the spoon, and spilt the broth upon the table-cloth or let it run out of his mouth. His son and his son's wife were disgusted at this, so the old grandfather at last had to sit in the corner behind the stove, and they gave him his food in an earthenware bowl, and not even enough of it. And he used to look towards the table with his eyes full of tears. Once, too, his trembling hands could not hold the bowl, and it fell to the ground and broke. The young wife scolded him, but he said nothing and only sighed. Then they brought him a wooden bowl for a few half-pence, out of which he had to eat.",,,,,,
"Frederick of course made no objection to that plan, and they set off into the wood to look for the thieves; but they could not find them: and when it grew dark, they climbed up into a tree to spend the night there. Scarcely were they up, than who should come by but the very rogues they were looking for. They were in truth great rascals, and belonged to that class of people who find things before they are lost; they were tired; so they sat down and made a fire under the very tree where Frederick and Catherine were. Frederick slipped down on the other side, and picked up some stones. ",,,,,,
"It would have been all over with the poor girl if she had not just then been standing in a corner, and heard everything. All day long she dared not go out of doors, and when bedtime had come, the witch's daughter got into bed first, so as to lie at the far side, but when she was asleep, the other pushed her gently to the front, and took for herself the place at the back, close by the wall. In the night, the old woman came creeping in, she held an axe in her right hand, and felt with her left to see if anyone were lying at the outside, and then she grasped the axe with both hands, and cut her own child's head off.",,,,,,
"Then Clever Elsie took the pitcher from the wall, went into the cellar, and tapped the lid briskly as she went, so that the time might not appear long. When she was below she fetched herself a chair, and set it before the barrel so that she had no need to stoop, and did not hurt her back or do herself any unexpected injury. Then she placed the can before her, and turned the tap, and while the beer was running she would not let her eyes be idle, but looked up at the wall, and after much peering here and there, saw a pick-axe exactly above her, which the masons had accidentally left there.",,,,,,
"Then he bought for the first two the fine clothes and pearls and diamonds they had asked for: and on his way home, as he rode through a green copse, a hazel twig brushed against him, and almost pushed off his hat: so he broke it off and brought it away; and when he got home he gave it to his daughter. Then she took it, and went to her mother's grave and planted it there; and cried so much that it was watered with her tears; and there it grew and became a fine tree. Three times every day she went to it and cried; and soon a little bird came and built its nest upon the tree, and talked with her, and watched over her, and brought her whatever she wished for.",,,,,,
"A long time ago there lived a king who was famed for his wisdom through all the land. Nothing was hidden from him, and it seemed as if news of the most secret things was brought to him through the air. But he had a strange custom; every day after dinner, when the table was cleared, and no one else was present, a trusty servant had to bring him one more dish. It was covered, however, and even the servant did not know what was in it, neither did anyone know, for the king never took off the cover to eat of it until he was quite alone.",,,,,,
"They were terrified and wanted to hide themselves. One sprang under the table, the second into the bed, the third into the stove, the fourth into the kitchen, the fifth into the cupboard, the sixth under the washing-bowl, and the seventh into the clock-case. But the wolf found them all, and used no great ceremony; one after the other he swallowed them down his throat. The youngest, who was in the clock-case, was the only one he did not find. When the wolf had satisfied his appetite he took himself off, laid himself down under a tree in the green meadow outside, and began to sleep. Soon afterwards the old goat came home again from the forest. Ah! what a sight she saw there! The house-door stood wide open. The table, chairs, and benches were thrown down, the washing-bowl lay broken to pieces, and the quilts and pillows were pulled off the bed. She sought her children, but they were nowhere to be found. She called them one after another by name, but no one answered. ",,,,,,
"The goldsmith was in his workshop making a gold chain, when he heard the song of the bird on his roof. He thought it so beautiful that he got up and ran out, and as he crossed the threshold he lost one of his slippers. But he ran on into the middle of the street, with a slipper on one foot and a sock on the other; he still had on his apron, and still held the gold chain and the pincers in his hands, and so he stood gazing up at the bird, while the sun came shining brightly down on the street.",,,,,,
"Then away they hastened with her full of joy in their boat towards the ship; but soon came the dragon roaring behind them through the air; for he awoke and missed the princess. But when he got over the boat, and wanted to pounce upon them and carry off the princess, the huntsman took up his bow and shot him straight through the heart so that he fell down dead. They were still not safe; for he was such a great beast that in his fall he overset the boat, and they had to swim in the open sea upon a few planks. So the tailor took his needle, and with a few large stitches put some of the planks together; and he sat down upon these, and sailed about and gathered up all pieces of the boat; and then tacked them together so quickly that the boat was soon ready, and they then reached the ship and got home safe.",,,,,,
"The next morning she asked the way she was to go, and took leave of her father, and went forth with a bold heart into the wood. But the lion was an enchanted prince. By day he and all his court were lions, but in the evening they took their right forms again. And when Lily came to the castle, he welcomed her so courteously that she agreed to marry him. The wedding-feast was held, and they lived happily together a long time. The prince was only to be seen as soon as evening came, and then he held his court; but every morning he left his bride, and went away by himself, she knew not whither, till the night came again.",,,,,,
"Then his eyes fell on the things which were lying beside him; he read the letter, and knew from it all that had happened. He rose up without delay, eager to start on his way and to reach the castle of Stromberg, but he had no idea in which direction he ought to go. He travelled about a long time in search of it and came at last to a dark forest, through which he went on walking for fourteen days and still could not find a way out. Once more the night came on, and worn out he lay down under a bush and fell asleep. Again the next day he pursued his way through the forest, and that evening, thinking to rest again, he lay down as before, but he heard such a howling and wailing that he found it impossible to sleep. He waited till it was darker and people had begun to light up their houses, and then seeing a little glimmer ahead of him, he went towards it.",,,,,,
"Soon afterwards he came to a city, where a king ruled who had a daughter who was so serious that no one could make her laugh. So he had put forth a decree that whosoever should be able to make her laugh should marry her. When Dummling heard this, he went with his goose and all her train before the king's daughter, and as soon as she saw the seven people running on and on, one behind the other, she began to laugh quite loudly, and as if she would never stop. Thereupon Dummling asked to have her for his wife; but the king did not like the son-in-law, and made all manner of excuses and said he must first produce a man who could drink a cellarful of wine. Dummling thought of the little grey man, who could certainly help him; so he went into the forest, and in the same place where he had felled the tree, he saw a man sitting, who had a very sorrowful face.",,,,,,
"He walked on; and as he walked through beautiful gardens he came to a delightful shady spot in which stood a couch; and he thought to himself, as he felt tired, that he would rest himself for a while, and gaze on the lovely scenes around him. So he laid himself down, and sleep fell upon him unawares, so that he did not wake up till the clock was striking a quarter to twelve. Then he sprang from the couch dreadfully frightened, ran to the well, filled a cup that was standing by him full of water, and hastened to get away in time. Just as he was going out of the iron door it struck twelve, and the door fell so quickly upon him that it snapped off a piece of his heel.",,,,,,
"The twelve huntsmen always followed the king to the chase, and his liking for them continually increased. Now it came to pass that once when they were out hunting, news came that the king's bride was approaching. When the true bride heard that, it hurt her so much that her heart was almost broken, and she fell fainting to the ground. The king thought something had happened to his dear huntsman, ran up to him, wanted to help him, and drew his glove off. Then he saw the ring which he had given to his first bride, and when he looked in her face he recognized her. ",,,,,,
"So, to make a sort of drawn battle of the matter, it was settled that Heinel should be put into an open boat, that lay on the sea-shore hard by; that the father should push him off with his own hand, and that he should thus be set adrift, and left to the bad or good luck of wind and weather. Then he took leave of his father, and set himself in the boat, but before it got far off a wave struck it, and it fell with one side low in the water, so the merchant thought that poor Heinel was lost, and went home very sorrowful, while the dwarf went his way, thinking that at any rate he had had his revenge.",,,,,,
